{
  "artifact_id": "magnetar-2024-core-interior",
  "diffs": [],
  "excluded": [
    {
      "category": "walls",
      "field": "entity_counts.IFCWALL",
      "reason": "decoder_baseline",
      "tracking_issue": 211,
      "unsupported_feature": null
    },
    {
      "category": "floors",
      "field": "entity_counts.IFCSLAB",
      "reason": "decoder_baseline",
      "tracking_issue": 212,
      "unsupported_feature": null
    },
    {
      "category": "doors",
      "field": "entity_counts.IFCDOOR",
      "reason": "decoder_baseline",
      "tracking_issue": 211,
      "unsupported_feature": null
    },
    {
      "category": "windows",
      "field": "entity_counts.IFCWINDOW",
      "reason": "decoder_baseline",
      "tracking_issue": 211,
      "unsupported_feature": null
    },
    {
      "category": "rooms_spaces",
      "field": "entity_counts.IFCSPACE",
      "reason": "decoder_baseline",
      "tracking_issue": 90,
      "unsupported_feature": null
    },
    {
      "category": "columns",
      "field": "entity_counts.IFCCOLUMN",
      "reason": "decoder_baseline",
      "tracking_issue": 204,
      "unsupported_feature": null
    },
    {
      "category": "materials",
      "field": "entity_counts.IFCMATERIAL",
      "reason": "known_gap",
      "tracking_issue": 34,
      "unsupported_feature": "revit_compound_assemblies_and_walltype_widths"
    },
    {
      "category": "property_sets",
      "field": "entity_counts.IFCPROPERTYSET",
      "reason": "known_gap",
      "tracking_issue": 35,
      "unsupported_feature": "partial_revit_element_parameters"
    },
    {
      "category": "shading_devices",
      "field": "entity_counts.IFCSHADINGDEVICE",
      "reason": "decoder_baseline",
      "tracking_issue": 212,
      "unsupported_feature": null
    },
    {
      "category": "opening_fills",
      "field": "relations.IFCRELFILLSELEMENT",
      "reason": "decoder_baseline",
      "tracking_issue": 222,
      "unsupported_feature": null
    }
  ],
  "independence": {
    "commercial_dropped": [],
    "lineages": [
      "ifc-lite",
      "ifcopenshell",
      "rvt-rs"
    ],
    "roles": [
      "bridge",
      "source"
    ],
    "satisfied": true,
    "strong_copyleft": []
  },
  "inputs": {
    "ifc-lite": {
      "input_hash_sha256": "d07c7462aee22640661faed5262cf802ce0fcbc663f312961a39be92bf857050",
      "role": "bridge",
      "witness_version": "7.1.1"
    },
    "ifcopenshell": {
      "input_hash_sha256": "d07c7462aee22640661faed5262cf802ce0fcbc663f312961a39be92bf857050",
      "role": "bridge",
      "witness_version": "0.9.0.post1"
    },
    "rvt-rs": {
      "input_hash_sha256": "c805df445d613b408e37337765572021265e3f5dfdc7d1fa53b22ba1600b8014",
      "role": "source",
      "witness_version": "0.5.1"
    }
  },
  "insufficient_witnesses": false,
  "replay": {
    "ifc-lite": "match",
    "ifcopenshell": "match",
    "rvt-rs": "match"
  },
  "schema_version": "1.0.0",
  "semantic_surface": [
    "entity_counts.IFCBUILDINGSTOREY",
    "entity_counts.IFCROOF",
    "entity_counts.IFCBEAM",
    "entity_counts.IFCFLOWTERMINAL",
    "entity_counts.IFCUNITASSIGNMENT",
    "storeys.IFCBUILDINGSTOREY"
  ],
  "status": "PASS",
  "verdict_hash_sha256": "3446e56f5fb3d3d921db12faa6775ac3324adedd3d311a3feafdd2b91c1ec3e4",
  "witnesses_compared": [
    "ifc-lite",
    "ifcopenshell",
    "rvt-rs"
  ]
}
