{
  "artifact_id": "magnetar-2024-core-interior-slim",
  "diffs": [],
  "excluded": [
    {
      "category": "materials",
      "field": "entity_counts.IFCMATERIAL",
      "reason": "known_gap",
      "tracking_issue": 34,
      "unsupported_feature": "revit_compound_assemblies_and_walltype_widths"
    },
    {
      "category": "property_sets",
      "field": "entity_counts.IFCPROPERTYSET",
      "reason": "known_gap",
      "tracking_issue": 35,
      "unsupported_feature": "partial_revit_element_parameters"
    }
  ],
  "independence": {
    "commercial_dropped": [],
    "lineages": [
      "ifc-lite",
      "ifcopenshell",
      "rvt-rs"
    ],
    "roles": [
      "bridge",
      "source"
    ],
    "satisfied": true,
    "strong_copyleft": []
  },
  "inputs": {
    "ifc-lite": {
      "input_hash_sha256": "bfdf36ffb0bb768f3409d818403990e64d4c262c6780603be87f8077387ad86d",
      "role": "bridge",
      "witness_version": "7.1.1"
    },
    "ifcopenshell": {
      "input_hash_sha256": "bfdf36ffb0bb768f3409d818403990e64d4c262c6780603be87f8077387ad86d",
      "role": "bridge",
      "witness_version": "0.9.0.post1"
    },
    "rvt-rs": {
      "input_hash_sha256": "c805df445d613b408e37337765572021265e3f5dfdc7d1fa53b22ba1600b8014",
      "role": "source",
      "witness_version": "0.6.1"
    }
  },
  "insufficient_witnesses": false,
  "replay": {
    "ifc-lite": "match",
    "ifcopenshell": "match",
    "rvt-rs": "match"
  },
  "schema_version": "1.0.0",
  "semantic_surface": [
    "entity_counts.IFCBUILDINGSTOREY",
    "entity_counts.IFCWALL",
    "entity_counts.IFCSLAB",
    "entity_counts.IFCROOF",
    "entity_counts.IFCDOOR",
    "entity_counts.IFCWINDOW",
    "entity_counts.IFCSPACE",
    "entity_counts.IFCCOLUMN",
    "entity_counts.IFCBEAM",
    "entity_counts.IFCFLOWTERMINAL",
    "entity_counts.IFCUNITASSIGNMENT",
    "entity_counts.IFCSHADINGDEVICE",
    "relations.IFCRELFILLSELEMENT",
    "storeys.IFCBUILDINGSTOREY"
  ],
  "status": "PASS",
  "verdict_hash_sha256": "e41374c1613b594535b3e5af13f29fba01082dc29e8e7cb3b37af64d04f6ed88",
  "witnesses_compared": [
    "ifc-lite",
    "ifcopenshell",
    "rvt-rs"
  ]
}
